{
  "packageName": "v1",
  "name": "Monitor",
  "documentation": {
    "description": "Monitor client is used to manage resources for Twilio Monitor"
  },
  "config": {
    "beta": false,
    "subDomain": "monitor",
    "apiVersion": "v1"
  },
  "subClients": [
    {
      "name": "Alerts",
      "packageName": "alerts",
      "documentation": {
        "description": "Client for managing alert resources",
        "twilioDocsLink": "https://www.twilio.com/docs/usage/monitor-alert"
      },
      "operations": [
        {
          "name": "Page",
          "http": {
            "uri": "/Alerts",
            "method": "Get",
            "queryParams": [
              {
                "name": "PageSize",
                "type": "int",
                "required": false
              },
              {
                "name": "Page",
                "type": "int",
                "required": false
              },
              {
                "name": "PageToken",
                "type": "string",
                "required": false
              },
              {
                "name": "LogLevel",
                "type": "string",
                "required": false
              },
              {
                "name": "StartDate",
                "type": "time.Time",
                "required": false
              },
              {
                "name": "EndDate",
                "type": "time.Time",
                "required": false
              }
            ]
          },
          "documentation": {
            "description": "retrieves a page of alerts",
            "twilioDocsLink": "https://www.twilio.com/docs/usage/monitor-alert#read-multiple-alert-resources"
          },
          "response": {
            "structure": "AlertsPageResponse",
            "documentation": {
              "description": "defines the response fields for the alerts page"
            }
          },
          "pagination": {
            "name": "AlertsPaginator",
            "page": {
              "name": "AlertsPage",
              "nextToken": "PageToken",
              "nextPage": {
                "meta": true,
                "property": "NextPageURL"
              },
              "items": "Alerts",
              "structure": "PageAlertResponse"
            }
          }
        }
      ]
    },
    {
      "name": "Alert",
      "packageName": "alert",
      "function": {
        "parameters": {
          "alertSid": {
            "dataType": "string"
          }
        }
      },
      "properties": {
        "sid": {
          "dataType": "string",
          "functionParameter": "alertSid"
        }
      },
      "documentation": {
        "description": "Client for managing a specific alert resource",
        "twilioDocsLink": "https://www.twilio.com/docs/usage/monitor-alert"
      },
      "operations": [
        {
          "name": "Fetch",
          "http": {
            "uri": "/Alerts/{sid}",
            "method": "Get",
            "pathParams": [
              {
                "name": "sid",
                "value": {
                  "onService": true,
                  "type": "string",
                  "property": "sid"
                }
              }
            ]
          },
          "documentation": {
            "description": "retrieves an alert resource",
            "twilioDocsLink": "https://www.twilio.com/docs/usage/monitor-alert#fetch-an-alert-resource"
          },
          "response": {
            "name": "FetchAlertResponse",
            "structure": "AlertResponse",
            "documentation": {
              "description": "defines the response fields for the retrieved alert"
            }
          }
        }
      ]
    },
    {
      "name": "Events",
      "packageName": "events",
      "documentation": {
        "description": "Client for managing event resources",
        "twilioDocsLink": "https://www.twilio.com/docs/usage/monitor-events"
      },
      "operations": [
        {
          "name": "Page",
          "http": {
            "uri": "/Events",
            "method": "Get",
            "queryParams": [
              {
                "name": "PageSize",
                "type": "int",
                "required": false
              },
              {
                "name": "Page",
                "type": "int",
                "required": false
              },
              {
                "name": "PageToken",
                "type": "string",
                "required": false
              },
              {
                "name": "ActorSid",
                "type": "string",
                "required": false
              },
              {
                "name": "EventType",
                "type": "string",
                "required": false
              },
              {
                "name": "ResourceSid",
                "type": "string",
                "required": false
              },
              {
                "name": "SourceIPAddress",
                "type": "string",
                "required": false
              },
              {
                "name": "StartDate",
                "type": "time.Time",
                "required": false
              },
              {
                "name": "EndDate",
                "type": "time.Time",
                "required": false
              }
            ]
          },
          "documentation": {
            "description": "retrieves a page of events",
            "twilioDocsLink": "https://www.twilio.com/docs/usage/monitor-events#read-multiple-event-resources"
          },
          "response": {
            "structure": "EventsPageResponse",
            "documentation": {
              "description": "defines the response fields for the events page"
            }
          },
          "pagination": {
            "name": "EventsPaginator",
            "page": {
              "name": "EventsPage",
              "nextToken": "PageToken",
              "nextPage": {
                "meta": true,
                "property": "NextPageURL"
              },
              "items": "Events",
              "structure": "PageEventResponse"
            }
          }
        }
      ]
    },
    {
      "name": "Event",
      "packageName": "event",
      "function": {
        "parameters": {
          "eventSid": {
            "dataType": "string"
          }
        }
      },
      "properties": {
        "sid": {
          "dataType": "string",
          "functionParameter": "eventSid"
        }
      },
      "documentation": {
        "description": "Client for managing a specific event resource",
        "twilioDocsLink": "https://www.twilio.com/docs/usage/monitor-events"
      },
      "operations": [
        {
          "name": "Fetch",
          "http": {
            "uri": "/Events/{sid}",
            "method": "Get",
            "pathParams": [
              {
                "name": "sid",
                "value": {
                  "onService": true,
                  "type": "string",
                  "property": "sid"
                }
              }
            ]
          },
          "documentation": {
            "description": "retrieves an event resource",
            "twilioDocsLink": "https://www.twilio.com/docs/usage/monitor-events#fetch-an-event-resource"
          },
          "response": {
            "name": "FetchEventResponse",
            "structure": "EventResponse",
            "documentation": {
              "description": "defines the response fields for the retrieved event"
            }
          }
        }
      ]
    }
  ],
  "structures": {
    "AlertsPageResponse": {
      "type": "JSON",
      "properties": [
        {
          "name": "Meta",
          "structure": "MetaResponse",
          "value": "meta",
          "required": true
        },
        {
          "name": "Alerts",
          "type": "array",
          "items": {
            "structure": "AlertResponse"
          },
          "value": "alerts",
          "required": true
        }
      ]
    },
    "AlertResponse": {
      "type": "JSON",
      "extends": "BaseResponse",
      "properties": [
        {
          "name": "AlertText",
          "type": "string",
          "value": "alert_text",
          "required": false
        },
        {
          "name": "APIVersion",
          "type": "string",
          "value": "api_version",
          "required": false
        },
        {
          "name": "ErrorCode",
          "type": "string",
          "value": "error_code",
          "required": true
        },
        {
          "name": "LogLevel",
          "type": "string",
          "value": "log_level",
          "required": true
        },
        {
          "name": "MoreInfo",
          "type": "string",
          "value": "more_info",
          "required": true
        },
        {
          "name": "RequestHeaders",
          "type": "string",
          "value": "request_headers",
          "required": false
        },
        {
          "name": "RequestMethod",
          "type": "string",
          "value": "request_method",
          "required": false
        },
        {
          "name": "RequestURL",
          "type": "string",
          "value": "request_url",
          "required": false
        },
        {
          "name": "RequestVariables",
          "type": "string",
          "value": "request_variables",
          "required": false
        },
        {
          "name": "ResourceSid",
          "type": "string",
          "value": "resource_sid",
          "required": true
        },
        {
          "name": "ResponseBody",
          "type": "string",
          "value": "response_body",
          "required": false
        },
        {
          "name": "ResponseHeaders",
          "type": "string",
          "value": "response_headers",
          "required": false
        },
        {
          "name": "ServiceSid",
          "type": "string",